{
  "paper_id": "arxiv:2604.20765v1",
  "tags": [
    "vulnerability-management",
    "patch-deployment",
    "critical-vulnerabilities",
    "cvss-scoring",
    "remediation-delays",
    "sector-analysis",
    "cve-lifecycle",
    "mixed-methods-study"
  ],
  "categories": {
    "primary": "cs.CR",
    "secondary": [
      "vulnerability-management",
      "patch-deployment",
      "severity-scoring",
      "empirical-security"
    ]
  },
  "classification": {
    "research_type": "empirical mixed-methods study",
    "contribution_type": [
      "measurement study",
      "case studies",
      "benchmark analysis",
      "longitudinal analysis"
    ],
    "maturity": "established",
    "domain": "vulnerability management and remediation"
  },
  "topic": {
    "what": "Analysis of critical vulnerabilities (CVSS ≥9.0) identification and remediation timelines spanning 16 years",
    "how": "Mixed-methods combining quantitative analysis of 245,456 CVE records (2009-2024) with qualitative case studies of Heartbleed, EternalBlue, Log4Shell",
    "why_matters": "Critical vulnerabilities pose severe risks; understanding remediation delays helps organizations prioritize security investments and improve response efficiency"
  },
  "characteristics": [
    {
      "dimension": "disclosure_time",
      "what_it_measures": "Average days from CVE reservation to public disclosure",
      "unit": "days",
      "direction": "lower_is_better",
      "value": "33 days (2024), down from 400+ days (2013)",
      "value_numeric": 33,
      "value_class": "parametric",
      "vs_baseline": "Critical CVEs published faster than overall average in earlier years (57 vs 105 days in 2009)",
      "evidence": "NVD and MITRE CVE database analysis",
      "confidence": "high",
      "context": "CNA expansion post-2016 accelerated disclosure; convergence between critical and all CVEs in recent years"
    },
    {
      "dimension": "remediation_time",
      "what_it_measures": "Time from disclosure to patch availability",
      "unit": "days",
      "direction": "lower_is_better",
      "value": "Mean 2,024 days, median 1,668 days for critical CVEs",
      "value_numeric": 2024,
      "value_class": "parametric",
      "vs_baseline": "Longer than all CVEs (mean 1,732 days, median 1,335 days)",
      "evidence": "NVD modification timestamps as patch proxy",
      "confidence": "high",
      "context": "50% of critical CVEs patched within 1,668 days; 90% within 4,689 days; \"last-mile\" problem identified"
    },
    {
      "dimension": "critical_cve_proportion",
      "what_it_measures": "Percentage of CVEs classified as critical (CVSS ≥9.0)",
      "unit": "percentage",
      "direction": "neutral",
      "value": "12.8% (31,430 of 245,456 total CVEs)",
      "value_numeric": 12.8,
      "value_class": "parametric",
      "vs_baseline": "Relatively stable throughout observation period",
      "evidence": "NVD JSON 2.0 feeds analysis",
      "confidence": "high",
      "context": "Peak of 2,589 critical CVEs in 2020"
    },
    {
      "dimension": "remediation_gap",
      "what_it_measures": "Discrepancy between disclosure speed and remediation speed",
      "unit": "days ratio",
      "direction": "lower_is_better",
      "value": "~50x gap (33 days disclosure vs 1,668 days remediation)",
      "value_numeric": 50,
      "value_class": "qualitative-strong",
      "vs_baseline": "Disclosure improved dramatically; remediation remained problematic",
      "evidence": "Comparative analysis across temporal dimensions",
      "confidence": "high",
      "context": "Systemic \"last-mile\" problem in vulnerability management"
    },
    {
      "dimension": "sector_variance",
      "what_it_measures": "Variation in patch availability times across industries",
      "unit": "days (median)",
      "direction": "lower_is_better",
      "value": "Range from <5 days (security vendors) to 2,000-4,000 days (commercial software)",
      "value_numeric": 5,
      "value_class": "parametric",
      "vs_baseline": "Open source and cloud providers faster than traditional industries",
      "evidence": "15 sectors analyzed with median-based comparison",
      "confidence": "medium",
      "context": "Healthcare, energy, telecommunications showed shorter cycles due to regulatory requirements"
    },
    {
      "dimension": "case_impact",
      "what_it_measures": "Real-world incidents illustrating remediation delays",
      "unit": "qualitative",
      "direction": "neutral",
      "value": "Heartbleed: 6+ months avg remediation despite 2-day patch; EternalBlue: 20% unpatched after 6 months; Log4Shell: weeks for full remediation",
      "value_numeric": null,
      "value_class": "qualitative-strong",
      "vs_baseline": "Demonstrates gap between patch availability and organizational remediation",
      "evidence": "Case study analysis of landmark vulnerabilities",
      "confidence": "high",
      "context": "Illustrates organizational inertia beyond vendor response times"
    }
  ],
  "applicability": {
    "good_for": [
      "Priority setting for critical vulnerability remediation",
      "Sector-specific patch SLA benchmarking",
      "Understanding long-term vulnerability management trends",
      "Organizations with limited security resources"
    ],
    "not_for": [
      "Real-time vulnerability detection",
      "Organizations without CVE/NVD integration",
      "Short-term threat prioritization",
      "Systems without asset visibility"
    ],
    "requires": [
      "Access to NVD/MITRE vulnerability databases",
      "Historical CVE data spanning multiple years",
      "Sector classification of assigners",
      "Organizational patch management processes"
    ]
  },
  "novelty": [
    "Longitudinal benchmark for critical vulnerability remediation (2009-2024)",
    "Quantification of \"last-mile\" remediation gap",
    "Sectoral comparison across 15+ industries with median analysis",
    "Actionable recommendations grounded in mixed-methods evidence"
  ],
  "open_problems": [
    "Right-censoring in recent years (2022+ data incomplete)",
    "Sector classification relies on heuristic matching",
    "Exploitation likelihood not measured for prioritization",
    "Organizational maturity factors not captured",
    "Regulatory impact on patching requires further study",
    "Automated remediation pipeline integration not addressed"
  ],
  "_meta": {
    "analyzed_at": "2026-05-01T10:00:00+00:00",
    "model": "MiniMax-M2.7",
    "input_kind": "full_text",
    "input_chars": 30265,
    "prompt_tokens": 6900,
    "completion_tokens": 2044,
    "total_tokens": 8944,
    "latency_s": 21.178,
    "finish_reason": "stop"
  }
}