{
  "paper_id": "text:charaka-samhita",
  "tags": ["gastritis", "ayurveda", "amlapitta", "pitta-dosha", "ancient-medicine", "herbal-therapy", "dietary-therapy", "foundational-text", "agni"],
  "categories": {
    "primary": "traditional-medicine",
    "secondary": ["gastroenterology", "ethnopharmacology", "dietetics"]
  },
  "classification": {
    "research_type": "theoretical",
    "contribution_type": ["framework", "technique"],
    "maturity": "deployed",
    "domain": "Ayurvedic gastroenterology"
  },
  "topic": {
    "what": "Foundational Ayurvedic text containing the earliest known description of amlapitta (acid gastritis) as a disorder of excess pitta dosha.",
    "how": "Constitutional diagnosis via dosha assessment; treatment through pitta-pacifying diet, cooling herbs (Shatavari, Yashtimadhu, Amalaki), and lifestyle modification.",
    "why_matters": "Provides a complete independent medical tradition's framework for the same disease entity Western medicine named 'gastritis' — enabling cross-paradigm comparison of diagnostic and therapeutic approaches."
  },
  "characteristics": [
    {
      "dimension": "diagnostic_framework_specificity",
      "what_it_measures": "How specifically the condition is defined and differentiated",
      "unit": "",
      "direction": "higher_is_better",
      "value": "Amlapitta clearly distinguished from other GI conditions via pitta/agni assessment",
      "value_numeric": null,
      "value_class": "qualitative-strong",
      "vs_baseline": "More specific gastric classification than Hippocratic corpus",
      "evidence": "Textual analysis of Chikitsasthana sections",
      "confidence": "medium",
      "context": "Ayurvedic diagnostic framework"
    },
    {
      "dimension": "herbal_formulary_breadth",
      "what_it_measures": "Number of specific herbal interventions documented",
      "unit": "herbs",
      "direction": "higher_is_better",
      "value": "20+ specific gastroprotective herbs with preparation methods",
      "value_numeric": 20,
      "value_class": "parametric",
      "vs_baseline": "",
      "evidence": "Enumeration from Charaka Samhita text",
      "confidence": "medium",
      "context": "Indian subcontinent botanical availability"
    }
  ],
  "applicability": {
    "good_for": ["Cross-paradigm gastritis comparison", "Herbal lead identification", "Understanding constitutional approaches to GI disease", "Historical ethnopharmacology"],
    "not_for": ["Evidence-based clinical guidelines", "Acute H. pylori treatment", "Modern pathophysiology"],
    "requires": ["Understanding of Ayurvedic dosha theory", "Botanical identification of Indian herbs"]
  },
  "novelty": [
    "Earliest known clinical description of acid gastritis (amlapitta)",
    "Complete constitutional framework linking body type to gastric disease susceptibility",
    "Integrated diet-herb-lifestyle approach predating modern integrative medicine by 2000 years",
    "Concept of agni (digestive fire) parallels modern understanding of gastric acid homeostasis"
  ],
  "open_problems": [
    "Dating uncertainty spans 400+ years",
    "No controlled clinical validation of traditional protocols",
    "Translation challenges affect interpretation of specific recommendations",
    "Dosha framework not mappable to modern biomarkers"
  ],
  "_meta": {
    "analyzed_at": "2026-05-01T00:00:00+00:00",
    "model": "claude-opus-4-6",
    "input_kind": "abstract_only",
    "input_chars": 0,
    "prompt_tokens": 0,
    "completion_tokens": 0,
    "total_tokens": 0,
    "latency_s": 0,
    "finish_reason": "manual"
  }
}
