{
  "paper_id": "text:bockus-1943",
  "tags": ["gastritis", "textbook", "gastroenterology", "pre-biopsy", "classification", "mid-century"],
  "categories": {"primary": "gastroenterology", "secondary": ["medical-history"]},
  "classification": {"research_type": "survey", "contribution_type": ["analysis"], "maturity": "deployed", "domain": "gastroenterology"},
  "topic": {"what": "Early comprehensive GI textbook with influential gastritis classification from the pre-biopsy era.", "how": "Clinical and early endoscopic synthesis of gastritis knowledge.", "why_matters": "Benchmark for pre-biopsy era gastritis understanding — shows what was known before histology and H. pylori transformed the field."},
  "characteristics": [{"dimension": "era_representativeness", "what_it_measures": "How well it represents its era's knowledge", "unit": "", "direction": "higher_is_better", "value": "Definitive mid-20th century GI reference", "value_numeric": null, "value_class": "qualitative-strong", "vs_baseline": "", "evidence": "Publishing history", "confidence": "medium", "context": "Pre-biopsy gastroenterology"}],
  "applicability": {"good_for": ["Historical baseline for GI knowledge evolution"], "not_for": ["Modern clinical use"], "requires": ["Medical history context"]},
  "novelty": ["One of earliest comprehensive GI subspecialty textbooks"],
  "open_problems": ["Pre-dates H. pylori, modern biopsy, and PPI era"],
  "_meta": {"analyzed_at":"2026-05-01T00:00:00+00:00","model":"claude-opus-4-6","input_kind":"abstract_only","input_chars":0,"prompt_tokens":0,"completion_tokens":0,"total_tokens":0,"latency_s":0,"finish_reason":"manual"}
}
