{
  "paper_id": "text:brinton-1859",
  "tags": ["gastritis", "stomach-diseases", "clinical-pathology", "acute-chronic-distinction", "pre-modern", "monograph"],
  "categories": {
    "primary": "gastroenterology",
    "secondary": ["pathology", "medical-history"]
  },
  "classification": {
    "research_type": "empirical",
    "contribution_type": ["analysis", "framework"],
    "maturity": "journal",
    "domain": "gastric pathology"
  },
  "topic": {
    "what": "Early systematic monograph devoted entirely to stomach diseases, establishing clinical-pathological correlation approach.",
    "how": "Consolidated mid-19th-century knowledge distinguishing acute from chronic gastritis and linking symptoms to anatomical findings.",
    "why_matters": "Established the clinical-pathological correlation framework that remained dominant until endoscopy and histology transformed the field a century later."
  },
  "characteristics": [
    {
      "dimension": "nosological_contribution",
      "what_it_measures": "Whether it introduced lasting disease classification concepts",
      "unit": "",
      "direction": "higher_is_better",
      "value": "Acute vs chronic gastritis distinction formalized",
      "value_numeric": null,
      "value_class": "qualitative-strong",
      "vs_baseline": "First dedicated gastric disease monograph",
      "evidence": "Published text",
      "confidence": "medium",
      "context": "Pre-endoscopy era"
    }
  ],
  "applicability": {
    "good_for": ["Historical context for gastritis classification"],
    "not_for": ["Modern clinical use"],
    "requires": ["19th century medical context"]
  },
  "novelty": ["First monograph devoted entirely to stomach diseases", "Formalized acute vs chronic gastritis distinction"],
  "open_problems": ["Pre-dates germ theory and endoscopy", "Classification lacks etiological specificity"],
  "_meta": {"analyzed_at":"2026-05-01T00:00:00+00:00","model":"claude-opus-4-6","input_kind":"abstract_only","input_chars":0,"prompt_tokens":0,"completion_tokens":0,"total_tokens":0,"latency_s":0,"finish_reason":"manual"}
}
