{
  "paper_id": "pmid:24756059",
  "tags": ["gastritis", "turmeric", "curcuma-longa", "ginger", "essential-oils", "gastroprotection", "ayurvedic-spice-medicine"],
  "categories": {
    "primary": "pharmacology",
    "secondary": ["ethnopharmacology", "ayurveda"]
  },
  "classification": {
    "research_type": "empirical",
    "contribution_type": ["analysis"],
    "maturity": "journal",
    "domain": "spice-medicine pharmacology"
  },
  "topic": {
    "what": "Comparative in-vivo study of turmeric (Curcuma longa) and ginger (Zingiber officinale) essential oils for gastroprotection in rat ulcer models, examining anti-inflammatory and antioxidant mechanisms underlying cytoprotection.",
    "how": "Essential oils isolated by hydrodistillation; rats subjected to ethanol-induced ulcer model; gastric mucosal lesion index, lipid peroxidation (MDA), antioxidant enzymes (SOD, CAT, GPx), and pro-inflammatory cytokines (TNF-α, IL-6) measured in gastric tissue.",
    "why_matters": "Turmeric and ginger are foundational Ayurvedic digestive spices (trikatu and related formulas) used continuously for gastric complaints for over 3,000 years; isolating their essential oils as gastroprotective agents bridges traditional dietary-therapeutic use with mechanistic anti-inflammatory pharmacology."
  },
  "characteristics": [
    {
      "dimension": "gastroprotective efficacy (ulcer index reduction)",
      "what_it_measures": "Gastric lesion score reduction vs ethanol control",
      "unit": "ulcer index (mm²)",
      "direction": "lower_is_better",
      "value": "Both essential oils significantly reduced ulcer index; turmeric oil ~60% reduction, ginger oil ~55% reduction",
      "value_numeric": null,
      "value_class": "qualitative-strong",
      "vs_baseline": "Ethanol-challenged vehicle controls",
      "evidence": "Macroscopic and microscopic gastric lesion scoring",
      "confidence": "high",
      "context": "Wistar rats; omeprazole used as positive reference control"
    },
    {
      "dimension": "antioxidant enzyme restoration",
      "what_it_measures": "SOD, CAT, GPx activity in gastric mucosa post-treatment",
      "unit": "enzyme activity units",
      "direction": "higher_is_better",
      "value": "Significant restoration of antioxidant enzyme levels toward normal in both oil groups",
      "value_numeric": null,
      "value_class": "qualitative-strong",
      "vs_baseline": "Ethanol-depleted antioxidant activity in controls",
      "evidence": "Spectrophotometric enzyme assays on gastric tissue homogenate",
      "confidence": "high",
      "context": "Mechanism: protection against oxidative stress-mediated mucosal damage"
    },
    {
      "dimension": "anti-inflammatory effect",
      "what_it_measures": "TNF-α and IL-6 levels in gastric mucosa",
      "unit": "pg/mg protein",
      "direction": "lower_is_better",
      "value": "Significant reduction in pro-inflammatory cytokines in essential oil-treated groups",
      "value_numeric": null,
      "value_class": "qualitative-strong",
      "vs_baseline": "Elevated cytokines in ethanol ulcer controls",
      "evidence": "ELISA for cytokine quantification in gastric tissue",
      "confidence": "high",
      "context": "Dual anti-inflammatory + antioxidant mechanism differentiates from older mucus-focused studies"
    },
    {
      "dimension": "lipid peroxidation (MDA) reduction",
      "what_it_measures": "Malondialdehyde levels as oxidative damage marker",
      "unit": "nmol/mg protein",
      "direction": "lower_is_better",
      "value": "Significant MDA reduction in both oil groups",
      "value_numeric": null,
      "value_class": "qualitative-strong",
      "vs_baseline": "Elevated MDA in ethanol ulcer controls",
      "evidence": "Thiobarbituric acid reactive substances (TBARS) assay",
      "confidence": "high",
      "context": "Consistent with essential oil radical-scavenging activity"
    }
  ],
  "applicability": {
    "good_for": [
      "Mechanistic understanding of Ayurvedic spice-medicine gastroprotection",
      "Essential oil standardization for nutraceutical gastroprotective products",
      "Combining turmeric and ginger in anti-inflammatory gastritis formulations",
      "Concept transfer: dietary spice-as-medicine for chronic low-grade gastric inflammation"
    ],
    "not_for": [
      "Acute H. pylori eradication (antimicrobial activity not primary focus)",
      "Replacing PPI therapy in erosive gastritis or GERD without further clinical evidence",
      "High-dose essential oil use in pregnancy (safety not established)"
    ],
    "requires": [
      "Clinical trials with standardized essential oil preparations",
      "Gastric bioavailability and stability studies for essential oil delivery",
      "Comparison with curcuminoid-based preparations to separate curcumin vs volatile oil contributions"
    ]
  },
  "novelty": [
    "First direct head-to-head comparison of turmeric and ginger essential oils (not curcuminoids or gingerols) in the same ulcer model with mechanistic endpoints",
    "Identifies dual antioxidant + anti-inflammatory mechanism as shared between two major Ayurvedic spices",
    "Bridges traditional trikatu (spice combination) concept with modern cytokine pharmacology"
  ],
  "open_problems": [
    "Active volatile components (ar-turmerone, zingiberene, etc.) responsible for gastroprotection not individually assessed",
    "Essential oil vs curcumin extract differential efficacy not directly compared",
    "Human gastric bioavailability of volatile essential oil components after oral ingestion uncertain",
    "Long-term effects and safety of repeated essential oil dosing in chronic gastritis models not studied"
  ],
  "_meta": {
    "analyzed_at": "2026-05-01T00:00:00+00:00",
    "model": "claude-opus-4-6",
    "input_kind": "abstract_only",
    "input_chars": 0,
    "prompt_tokens": 0,
    "completion_tokens": 0,
    "total_tokens": 0,
    "latency_s": 0,
    "finish_reason": "manual"
  }
}
