{
  "paper_id": "text:osler-1892",
  "tags": ["gastritis", "catarrhal-gastritis", "textbook", "pre-modern", "clinical-synthesis", "internal-medicine"],
  "categories": {"primary": "medical-history", "secondary": ["gastroenterology", "internal-medicine"]},
  "classification": {"research_type": "survey", "contribution_type": ["analysis"], "maturity": "deployed", "domain": "internal medicine"},
  "topic": {"what": "Landmark internal medicine textbook containing sections on 'Catarrhal Gastritis' reflecting late 19th-century understanding.", "how": "Clinical synthesis of contemporary knowledge framing gastritis as a catarrhal (mucus-secreting) process.", "why_matters": "Snapshot of gastritis understanding at the hinge between pre-modern and modern medicine — before bacteriology transformed the field."},
  "characteristics": [{"dimension": "historical_snapshot_value", "what_it_measures": "Value as a time-capsule of medical understanding", "unit": "", "direction": "higher_is_better", "value": "Captures 1890s gastritis understanding precisely", "value_numeric": null, "value_class": "qualitative-strong", "vs_baseline": "", "evidence": "Published text", "confidence": "high", "context": "Pre-bacteriology era"}],
  "applicability": {"good_for": ["Understanding pre-modern gastritis concepts", "Medical historiography"], "not_for": ["Clinical use"], "requires": ["19th century medical context"]},
  "novelty": ["Systematized clinical gastritis knowledge at a pivotal historical moment"],
  "open_problems": ["Entirely pre-bacterial understanding", "Catarrhal model abandoned"],
  "_meta": {"analyzed_at":"2026-05-01T00:00:00+00:00","model":"claude-opus-4-6","input_kind":"abstract_only","input_chars":0,"prompt_tokens":0,"completion_tokens":0,"total_tokens":0,"latency_s":0,"finish_reason":"manual"}
}
