{
  "paper_id": "arxiv:2604.24890v1",
  "tags": [
    "provenance-verification",
    "content-authentication",
    "C2PA",
    "metadata-security",
    "digital-forensics",
    "AI-generated-content",
    "cryptographic-signatures",
    "certificate-revocation"
  ],
  "categories": {
    "primary": "cybersecurity",
    "secondary": [
      "digital forensics",
      "content authentication",
      "cryptographic protocols"
    ]
  },
  "classification": {
    "research_type": "security analysis",
    "contribution_type": [
      "vulnerability analysis",
      "evaluation",
      "recommendations"
    ],
    "maturity": "early-stage",
    "domain": "digital media provenance"
  },
  "topic": {
    "what": "C2PA provenance verification system for digital media",
    "how": "first comprehensive independent security analysis including formal-methods analysis of C2PA core protocols, testing of real-world implementations and conformance program",
    "why_matters": "C2PA is being adopted for high-stakes applications like journalism, legal evidence, and financial disclosures despite failing its own security claims, risking premature trust in unreliable provenance signals"
  },
  "characteristics": [
    {
      "dimension": "specification_version_support",
      "what_it_measures": "Coverage of C2PA specification versions analyzed",
      "unit": "version count",
      "direction": "neutral",
      "value": "versions 2.2-2.4",
      "value_numeric": null,
      "value_class": "qualitative-strong",
      "vs_baseline": "N/A",
      "evidence": "Formal-methods analysis covered versions 2.2-2.4",
      "confidence": "high",
      "context": "Multiple specification versions analyzed for vulnerabilities"
    },
    {
      "dimension": "validator_consistency",
      "what_it_measures": "Agreement between different C2PA validation tools",
      "unit": "percentage agreement",
      "direction": "higher_is_better",
      "value": "0% for revoked certificates",
      "value_numeric": 0,
      "value_class": "qualitative-strong",
      "vs_baseline": "100% expected",
      "evidence": "Adobe Inspect and Verifieddit give contradictory results on same revoked certificate",
      "confidence": "high",
      "context": "Nikon Z6 III camera certificate revoked November 2025, validated by Adobe but rejected by Verifieddit 6+ months later"
    },
    {
      "dimension": "certificate_revocation_enforcement",
      "what_it_measures": "Whether conforming validators check for revoked certificates",
      "unit": "percentage compliance",
      "direction": "higher_is_better",
      "value": "not required by spec",
      "value_numeric": null,
      "value_class": "qualitative-weak",
      "vs_baseline": "100% required",
      "evidence": "Specifications make revocation checking optional",
      "confidence": "high",
      "context": "Design flaw: revocation checking intentionally optional for privacy reasons"
    },
    {
      "dimension": "timestamp_binding_integrity",
      "what_it_measures": "Whether timestamps are cryptographically bound to signed content",
      "unit": "integrity status",
      "direction": "higher_is_better",
      "value": "vulnerable to replacement",
      "value_numeric": null,
      "value_class": "qualitative-weak",
      "vs_baseline": "secure binding required",
      "evidence": "Formal-methods analysis found timestamps can be replaced without detection",
      "confidence": "high",
      "context": "Nothing in signed data references the timestamp, allowing removal and replacement"
    },
    {
      "dimension": "file_protection_coverage",
      "what_it_measures": "Percentage of file bytes protected by C2PA signatures",
      "unit": "percentage",
      "direction": "higher_is_better",
      "value": "partial coverage only",
      "value_numeric": null,
      "value_class": "qualitative-weak",
      "vs_baseline": "100% expected",
      "evidence": "Exclusion ranges allow portions of files to be modified without invalidating signatures",
      "confidence": "high",
      "context": "Google Pixel 10 Pro places GPS in exclusion range; can be altered without detection"
    },
    {
      "dimension": "credential_longevity",
      "what_it_measures": "Time before C2PA-signed media becomes unverifiable",
      "unit": "months",
      "direction": "higher_is_better",
      "value": "sometimes within months",
      "value_numeric": null,
      "value_class": "qualitative-weak",
      "vs_baseline": "22+ months required for legal compliance",
      "evidence": "Arizona Secretary of State C2PA pilot image expired within one year",
      "confidence": "high",
      "context": "Incompatible with 52 U.S.C. § 20701 (22 months), 12 C.F.R. § 1002.12 (25 months), 47 C.F.R. § 73.3526 (2 years)"
    },
    {
      "dimension": "conformance_program_effectiveness",
      "what_it_measures": "Whether certified products comply with specifications",
      "unit": "compliance status",
      "direction": "higher_is_better",
      "value": "certification does not ensure compliance",
      "value_numeric": null,
      "value_class": "qualitative-weak",
      "vs_baseline": "100% compliance expected",
      "evidence": "Certification based on self-reported compliance with no examination of functionality or source code",
      "confidence": "high",
      "context": "Conforming products do not necessarily comply with specifications; complying with flawed specs does not satisfy security goals"
    }
  ],
  "applicability": {
    "good_for": [
      "evaluating C2PA deployment readiness",
      "informing policy on provenance systems",
      "identifying cryptographic binding vulnerabilities",
      "understanding conformance program weaknesses"
    ],
    "not_for": [
      "high-stakes authentication decisions",
      "replacing forensic analysis",
      "legal evidence verification",
      "archival record keeping"
    ],
    "requires": [
      "access to C2PA validators",
      "understanding of cryptographic protocols",
      "familiarity with certificate validation"
    ]
  },
  "novelty": [
    "first formal-methods analysis of C2PA core protocols",
    "first comprehensive independent security analysis of C2PA",
    "demonstration of timestamp forging without detection",
    "exposure of validator inconsistency on revoked certificates",
    "documentation of credential expiration failures in production deployments"
  ],
  "open_problems": [
    "enabling strict certificate revocation checking with privacy preservation",
    "securing timestamp binding to prevent replacement attacks",
    "achieving validator consistency across different tools",
    "protecting entire file including non-C2PA metadata",
    "ensuring credential longevity for long-term archival needs",
    "establishing independent security audits for certified products",
    "clarifying C2PA limitations in public communications",
    "integrating C2PA with reputation and fact-checking services"
  ],
  "_meta": {
    "analyzed_at": "2026-05-01T10:00:00+00:00",
    "model": "MiniMax-M2.7",
    "input_kind": "full_text",
    "input_chars": 13795,
    "prompt_tokens": 3572,
    "completion_tokens": 1562,
    "total_tokens": 5134,
    "latency_s": 18.415,
    "finish_reason": "stop"
  }
}