{
  "paper_id": "arxiv:2604.22866v1",
  "tags": [
    "postphenomenology",
    "risk-models",
    "cybersecurity",
    "artifact-mediation",
    "technological-intentionality",
    "CIIM",
    "systemic-collapse",
    "philosophy-of-technology",
    "human-technology-relations"
  ],
  "categories": {
    "primary": "cs.CR",
    "secondary": [
      "cs.ET",
      "philosophy-of-technology"
    ]
  },
  "classification": {
    "research_type": "theoretical-analysis",
    "contribution_type": [
      "philosophical-framework",
      "conceptual-model",
      "design-methodology"
    ],
    "maturity": "emerging",
    "domain": "philosophy-of-cybersecurity"
  },
  "topic": {
    "what": "Postphenomenological analysis of how formal risk models function as mediating artifacts that shape security practitioner perception and action",
    "how": "Applies Ihde's human-technology relations taxonomy and Verbeek's mediation framework to analyze CIIM risk model as empirical case study",
    "why_matters": "Reveals how risk model design choices embody normative orientations that shape professional experience, agency, and ethical deliberation in ways typically invisible to practitioners"
  },
  "characteristics": [
    {
      "dimension": "temporal_projection_capability",
      "what_it_measures": "Whether risk model provides static snapshot or forward-looking projection",
      "unit": "categorical",
      "direction": "unknown",
      "value": "t+1 projection vs static",
      "value_numeric": null,
      "value_class": "qualitative-strong",
      "vs_baseline": "CVSS provides static present-tense scores; CIIM projects t+1",
      "evidence": "Paper explicitly contrasts CIIM's forward orientation with CVSS's present-only orientation",
      "confidence": "high",
      "context": "CIIM(t+1) formula intentionally outputs future state rather than current assessment"
    },
    {
      "dimension": "contextual_sensitivity",
      "what_it_measures": "Degree to which model accounts for organizational-specific factors",
      "unit": "categorical",
      "direction": "unknown",
      "value": "high context sensitivity",
      "value_numeric": null,
      "value_class": "qualitative-strong",
      "vs_baseline": "CVSS base scores are context-free; FAIR limited to financial translation",
      "evidence": "Perturbation function incorporates organizational lifeworld data from four auditable sources",
      "confidence": "high",
      "context": "P(t) = f(D_hist, D_real, B_user, A_patterns) ensures organization-specific calculations"
    },
    {
      "dimension": "boundary_condition_treatment",
      "what_it_measures": "How model handles edge conditions at limits of normal operation",
      "unit": "categorical",
      "direction": "unknown",
      "value": "singularity treatment vs epsilon smoothing",
      "value_numeric": null,
      "value_class": "qualitative-strong",
      "vs_baseline": "Standard models add epsilon to avoid division by zero; CIIM treats R(t)→0 as genuine systemic collapse",
      "evidence": "CIIM explicitly rejects epsilon smoothing for resilience denominator",
      "confidence": "high",
      "context": "R(t)→0 reveals organizational fragility as qualitative discontinuity rather than high numerical score"
    },
    {
      "dimension": "ethical_alignment",
      "what_it_measures": "Whether model incorporates normative cost-benefit considerations",
      "unit": "categorical",
      "direction": "unknown",
      "value": "explicit ethical intentionality via RL reward function",
      "value_numeric": null,
      "value_class": "qualitative-strong",
      "vs_baseline": "Traditional models optimize purely for risk reduction without cost considerations",
      "evidence": "RL reward R = -ΔCIIM - λ·action_cost incorporates proportionality principle",
      "confidence": "medium",
      "context": "Model embodies efficiency-oriented normative framework that shapes recommended interventions"
    }
  ],
  "applicability": {
    "good_for": [
      "theoretical-analysis",
      "design-methodology",
      "philosophical-frameworks",
      "interdisciplinary-research"
    ],
    "not_for": [
      "quantitative-evaluation",
      "empirical-validation",
      "direct-implementation",
      "performance-benchmarking"
    ],
    "requires": [
      "philosophical-literacy",
      "design-expertise",
      "interdisciplinary-collaboration"
    ]
  },
  "novelty": [
    "phenomenology-of-collapse-concept",
    "postphenomenological-analysis-cybersecurity-risk",
    "mediating-gap-framework",
    "boundary-disclosure-design-principle",
    "co-constitution-thesis-applied-abstract-instruments"
  ],
  "open_problems": [
    "empirical-validation-through-mixed-methods-studies",
    "translating-ethical-principles-into-design-guidelines",
    "further-development-collapse-phenomenology-concept",
    "Ihde-typology-supplementation-abstract-professional-instruments"
  ],
  "_meta": {
    "analyzed_at": "2026-05-01T10:00:00+00:00",
    "model": "MiniMax-M2.7",
    "input_kind": "full_text",
    "input_chars": 40848,
    "prompt_tokens": 8468,
    "completion_tokens": 1364,
    "total_tokens": 9832,
    "latency_s": 10.649,
    "finish_reason": "stop"
  }
}