{
  "paper_id": "text:faber-1935",
  "tags": ["gastritis", "atrophic-gastritis", "pernicious-anemia", "achlorhydria", "progressive-disease", "pre-modern"],
  "categories": {
    "primary": "gastroenterology",
    "secondary": ["hematology", "pathology"]
  },
  "classification": {
    "research_type": "empirical",
    "contribution_type": ["analysis"],
    "maturity": "journal",
    "domain": "gastric pathology"
  },
  "topic": {
    "what": "Systematic demonstration that chronic atrophic gastritis progresses to achlorhydria and pernicious anemia.",
    "how": "Longitudinal cohort observation tracing progression from inflammation to glandular atrophy to systemic disease.",
    "why_matters": "Established gastritis as a progressive, consequential condition — the intellectual precursor to Correa's carcinogenesis cascade."
  },
  "characteristics": [
    {
      "dimension": "disease_progression_model",
      "what_it_measures": "Whether a clear progression model was established",
      "unit": "",
      "direction": "higher_is_better",
      "value": "Clear progression: chronic gastritis → atrophy → achlorhydria → pernicious anemia",
      "value_numeric": null,
      "value_class": "qualitative-strong",
      "vs_baseline": "Built on Fenwick 1866 but added longitudinal evidence",
      "evidence": "Cohort observations",
      "confidence": "medium",
      "context": "Pre-B12 identification era"
    }
  ],
  "applicability": {
    "good_for": ["Understanding gastritis as progressive disease", "Historical context for Correa cascade"],
    "not_for": ["Modern clinical management"],
    "requires": ["Pre-vitamin B12 medical context"]
  },
  "novelty": ["First longitudinal evidence of gastritis progression to systemic disease", "Framed gastritis as consequential rather than benign"],
  "open_problems": ["B12 not yet identified", "Autoimmune mechanism unknown", "Small cohort by modern standards"],
  "_meta": {"analyzed_at":"2026-05-01T00:00:00+00:00","model":"claude-opus-4-6","input_kind":"abstract_only","input_chars":0,"prompt_tokens":0,"completion_tokens":0,"total_tokens":0,"latency_s":0,"finish_reason":"manual"}
}
