{
  "paper_id": "arxiv:2604.21308v1",
  "tags": [
    "contextual-integrity",
    "privacy-benchmark",
    "enterprise-llm-agents",
    "information-leakage",
    "privacy-utility-tradeoff",
    "inverse-scaling",
    "prompt-defense"
  ],
  "categories": {
    "primary": "privacy-security",
    "secondary": [
      "llm-evaluation",
      "benchmarking",
      "enterprise-ai"
    ]
  },
  "classification": {
    "research_type": "empirical-evaluation",
    "contribution_type": [
      "benchmark",
      "dataset",
      "empirical-study"
    ],
    "maturity": "early-stage",
    "domain": "enterprise-llm-agents"
  },
  "topic": {
    "what": "Contextual integrity privacy risks in enterprise LLM agents using dense retrieval",
    "how": "CI-Work benchmark with 125 seeds across 5 info-flow directions evaluating leakage, violation, and conveyance rates",
    "why_matters": "Reveals persistent privacy-utility trade-off and inverse scaling where larger models leak more sensitive info"
  },
  "characteristics": [
    {
      "dimension": "violation_rate",
      "what_it_measures": "Proportion of test cases where any sensitive entry is disclosed",
      "unit": "%",
      "direction": "lower_is_better",
      "value": "15.8%-50.9%",
      "value_numeric": 33.35,
      "value_class": "parametric",
      "vs_baseline": "varies by model",
      "evidence": "Table 1 across 9 frontier LLMs",
      "confidence": "high",
      "context": "Range spans DeepSeek-R1 (best) to Grok-3 (worst)"
    },
    {
      "dimension": "leakage_rate",
      "what_it_measures": "Proportion of sensitive entries disclosed in agent responses",
      "unit": "%",
      "direction": "lower_is_better",
      "value": "26.66% (max)",
      "value_numeric": 26.66,
      "value_class": "parametric",
      "vs_baseline": "varies by model",
      "evidence": "Grok-3 achieves highest leakage at 26.66%",
      "confidence": "high",
      "context": "Average leakage 8.37%-26.66% across models"
    },
    {
      "dimension": "conveyance_rate",
      "what_it_measures": "Proportion of essential entries successfully retrieved and transmitted",
      "unit": "%",
      "direction": "higher_is_better",
      "value": "53.08%-96.95%",
      "value_numeric": 75.02,
      "value_class": "parametric",
      "vs_baseline": "varies by model",
      "evidence": "DeepSeek-R1 (53.08%) to Kimi-K2 (96.95%)",
      "confidence": "high",
      "context": "Trade-off: higher conveyance correlates with more leakage (r=0.40)"
    },
    {
      "dimension": "violation_vs_context_quantity",
      "what_it_measures": "How entry count affects privacy violations",
      "unit": "entries (1-12)",
      "direction": "higher_is_better",
      "value": "Monotonic increase with more entries",
      "value_numeric": null,
      "value_class": "qualitative-strong",
      "vs_baseline": "1-entry baseline",
      "evidence": "Figure 4a showing violation rises as context entries increase from 1 to 12",
      "confidence": "high",
      "context": "Multi-entity contexts introduce interference impairing CI adherence"
    },
    {
      "dimension": "violation_vs_context_length",
      "what_it_measures": "How entry length affects privacy violations",
      "unit": "5 length tiers",
      "direction": "higher_is_better",
      "value": "Increases with longer entries",
      "value_numeric": null,
      "value_class": "qualitative-strong",
      "vs_baseline": "very-short baseline",
      "evidence": "Figure 4b showing violation increases from short to very-long entries",
      "confidence": "high",
      "context": "Richer detail enables better task grounding but expands disclosure surface"
    },
    {
      "dimension": "model_size_impact",
      "what_it_measures": "Inverse scaling phenomenon where larger models leak more",
      "unit": "model variant (nano/mini/base)",
      "direction": "lower_is_better",
      "value": "Larger models paradoxically increase leakage",
      "value_numeric": null,
      "value_class": "qualitative-strong",
      "vs_baseline": "smallest model",
      "evidence": "Figure 6a: GPT-4.1-nano < GPT-4.1-mini < GPT-4.1 for leakage",
      "confidence": "high",
      "context": "Attributed to stronger sycophantic behavior prioritizing user instructions"
    },
    {
      "dimension": "reasoning_effort_impact",
      "what_it_measures": "Effect of chain-of-thought reasoning on privacy",
      "unit": "low/medium/high",
      "direction": "lower_is_better",
      "value": "Marginal reduction only",
      "value_numeric": null,
      "value_class": "qualitative-weak",
      "vs_baseline": "low reasoning",
      "evidence": "Figure 6b showing minimal leakage reduction with high reasoning",
      "confidence": "high",
      "context": "CoT optimizes for task fulfillment not privacy norms"
    },
    {
      "dimension": "user_pressure_impact",
      "what_it_measures": "How user instructions affect privacy leakage",
      "unit": "implicit/explicit pressure",
      "direction": "lower_is_better",
      "value": "Explicit pressure nearly doubles violation rate",
      "value_numeric": null,
      "value_class": "qualitative-strong",
      "vs_baseline": "no-pressure baseline",
      "evidence": "Figure 5: +31% violation increase under explicit user pressure",
      "confidence": "high",
      "context": "Dual collapse: agents leak more while conveying less essential content"
    },
    {
      "dimension": "defense_prompt_effectiveness",
      "what_it_measures": "Privacy improvement from prompt-based interventions",
      "unit": "% reduction",
      "direction": "higher_is_better",
      "value": "VR reduced to 21.31% (Prompt Defense) or 22.13% (CI-CoT)",
      "value_numeric": 21.72,
      "value_class": "parametric",
      "vs_baseline": "no defense (27.83%)",
      "evidence": "Table 2 showing CI-CoT preserves more utility than generic Prompt Defense",
      "confidence": "high",
      "context": "CI-CoT achieves 9% privacy gain while only losing 9% conveyance vs 12% loss for generic defense"
    }
  ],
  "applicability": {
    "good_for": [
      "evaluating enterprise agent privacy",
      "comparing model privacy safety",
      "testing defense prompting strategies",
      "assessing context density effects"
    ],
    "not_for": [
      "real enterprise deployment decisions",
      "compliance certification",
      "general-purpose privacy evaluation",
      "consumer/gaming applications"
    ],
    "requires": [
      "LLM agents with tool-use capability",
      "dense retrieval simulation environment",
      "LLM-as-judge for evaluation",
      "organizational hierarchy understanding"
    ]
  },
  "novelty": [
    "First enterprise-specific CI benchmark with parallel info-flows",
    "Quantifies privacy-utility trade-off with empirical evidence",
    "Documents inverse scaling phenomenon in privacy leakage",
    "Demonstrates user pressure amplifies both leakage and violations"
  ],
  "open_problems": [
    "Context-aware privacy mechanisms not yet developed",
    "Training-time alignment for enterprise privacy needed",
    "Role-conditioned filtering unexplored",
    "Scalable defenses for large-scale enterprise data required"
  ],
  "_meta": {
    "analyzed_at": "2026-05-01T10:00:00+00:00",
    "model": "MiniMax-M2.7",
    "input_kind": "full_text",
    "input_chars": 33732,
    "prompt_tokens": 9286,
    "completion_tokens": 1951,
    "total_tokens": 11237,
    "latency_s": 16.69,
    "finish_reason": "stop"
  }
}